{
  "id": "no-sections",
  "title": "No Content Sections",
  "description": "A lesson is missing its content sections.",
  "difficulty": "foundational",
  "estimated_hours": 1,
  "tags": [],
  "prerequisites": { "essential": [], "helpful": [], "deep_background": [] },
  "related_topics": [],
  "modules": [
    {
      "id": "m", "title": "M", "description": "D",
      "learning_objectives": ["L"], "estimated_minutes": 10, "order": 1,
      "lessons": [{
        "id": "l", "title": "L", "order": 1, "estimated_minutes": 5,
        "content": { "sections": [] },
        "concepts_taught": [], "concepts_referenced": [],
        "examples": [], "exercises": [], "review_questions": []
      }],
      "assessment": { "questions": [{ "type": "conceptual", "question": "Q", "answer": "A", "concepts_tested": [] }] }
    }
  ],
  "source_urls": [],
  "generated_at": "2026-02-19T00:00:00Z",
  "version": 1
}
